Comment,Sentiment
grandmother teenager living farm mother father time dongguan electronics manufacturer world past year guangdong province father died rather abruptly inhaling toxic gas clearing crude drainage system farm left grandmother mother behind say farm confiscated ccp mother actually compensated equivalent penny dollar farmland worth really didnt choice matter would always distant relative stranger would stay farm freeload nowhere else go money starving grandmother mother kind hearted took less fortunate people best mean could provide point housed fed many sojourn whilst making way hong kong free trouble china time many heard prosperity british colony brought wanted piece pie year later even wife father swam across sea illegally enter hong kong government time announced issuing id card citizenship albeit heart still belongs china indoctrination generation subject really profound would often complain child love china would retort love china much hong kong would become frustrated good answer asked grandmother think mao zedong good enthusiastically answer without second hesitation yes yes he wonderful started blurting first phrase chinese national anthem song guess generation called lost generation,-1
kenya experienced kcse one exam make break life slept hour day lesson pm stressful pressure parent society sometimes much glad gone,-1
stunning party proud standing military law order voted helping veteran show disrespect distain law serve shame,-1
there way enter serial number search owner ever supposed stop gun violence stupid law like,-1
people coming stream show much promotion streamer give song suck barely play music without getting striked,-1
gg well played bro killing kindness,-1
prepare better making video,-1
person world gone completely nut,-1
time kill flatline insane,-1
case didnt know bedrock edition chance portal room make really hard speedrunners use bedrock get strong hold minute might even portal room,-1
chess easy learn yet hard master,-1
joe grandma big shit dawg dying,-1
mooshelle really sucking fancy pant dance chase,-1
man ray never disappointsi dont feel virally,-1
actually end getting trump reelected future laugh harder ever,-1
dont cut background noise use advantage way true asmrtist,-1
inflation getting crazy im gon na start cutting thing like making payment soon,-1
subscribe ill kick,-1
quickest way lose money follow guy aioz tweet said buy financial advice,-1
german id join server start speaking german complain try communicate english,-1
hulk fought alien monster sent space battle taken thanos forced hiding split personality hunted attacked military shehulk sort cat called three guy outside bar bos mansplaining early episode life word infinitely stressful real hulk show making feminism seem ridiculous less also smart hulk suck aaron american,-1
ellen still clue kicked day,-1
consciousness also ability tap collective consciousness around like someone look crowded place look back exactly time thats random chance there extra intelligence work cant really prove yet inability understand stuff reason science doesnt believe,-1
also dont job something afford stay nothing,-1
sohe think buying stock smart feel sorry anyone buying stock right,-1
guy got x didnt even bat eye lid happened yet people think real cmon,-1
got electric bill never free,-1
pretty difficult change opinion people whose opinion dont require evidence especially presenting evidence contrary,-1
yes seems like line law enforcement criminality vigilantism extremely thin,-1
people dont think people able use cosmetic purpose scientist bold assume know,-1
poor kid still scared even tho shark dead,-1
twitter creating safer environment people freely express pxrge freely express twitter werent supposed,-1
creeped guy calling ai person anyone else,-1
sound effect get dead meme,-1
going lot people upset realize economy,-1
coming isolated away kid thousand km awaymy son chose read theology read law politics economics retain keen interest area discouraged choice questioned probably wrong,-1
bought ipad pro didnt think new feature would worth especially since waiting would force give student discount big deal know everyone want magsafe charging wireless charging actually dislike wireless charging thats unimportant performance gain dont matter since ipad already crazy fast rumor ive seen notch landscape mode would actually deter even ipad pro use ipad sheet music reader portrait mode notch would way noticeable get way workflow imagine looking sheet paper part edge cut away side annoying im happy honestly leak make even relieved im waiting personal preference workflow like,-1
im little disappointed calisto protocol gon na crossgen understandable development,-1
biology textbook worst thing ever written full chapter take page teach nothing thank god crash course,-1
rollie wrist im shit w kid bouta rain bitch ima rain bitch favorite part,-1
creator monopoly would speechless one,-1
day trump left officei remember comment made taking documentsand comment waswhy taking document,-1
funny enough old day mother sucked baby booger since tool said purpose didnt exist especially needed colder area,-1
administration starting remind time history called taxation without representation tax tax tax biden harris,-1
stockfish crush analyzes mistake gigachad,-1
ridiculous sony understand deal going matter business playstation time,-1
kid early could still write sloppy hand written page letter crayon drawing send nintendo america would immediately write back answering every single question matter dumb complementing crappy drawing detail think dad might still response letter desk day long gone,-1
awful sad see stuff go thrash general public get access look youtube mandatory ad friendly content social medium taking everything lack variety due company milking winning formula dry game company noticing casual player demanding quality suck,-1
play look easy play look like shit,-1
one saying fault overexploiting quinoa production bolivia poorest country south america rural people especially indigenous people living altiplano literally dont enough money live propper life quinoa boom meant thousand family could aford education bettering living standars getting poverty really easy talk unsustainable practice country got rich trough unsustainable practice plus exploitation million human being,-1
wouldve dropped everyone around,-1
lol day ago say rossolimo bad opening best chess engine play go show bad chess enormous difference,-1
elite series controller horizon microsoft really need focus quality control went series controller giving getting refund experienced faulty paddle loose buzzing rumble motor worst large deadzones analog stick really wanted love couldnt warrant spending kind money controller basic functionality issue,-1
seeing picture child brought tear eye,-1
sniperwolf dont google stuff instantly google,-1
got hit greatest weakness question responded sometimes im focused work people feel though im social dont stand around watercooler gossiping pop culture keep head get work done immediately used negative manner asked major character candidate looking told someone talk everyone lol felt like setup,-1
honestly main take away ive saying tinnitus wrong whole life,-1
zaten biriki istisna dnda futbolumuz komikten teye geemedi,-1
durk dropped aah ha first yb responded hate youngboy less hour get fact together,-1
indian heart wrenching watch happened native american tribe america heart go survivor,-1
thank find following interview question bit uncomfortable deal difficult people insisting knowing salary nice,-1
news portrayed guy insane story first came good interview,-1
wish soup would start lobby become admin cause chaos wait call adminhim,-1
black guy truest one dont fucking know im trying get money,-1
face describing hop killed smell pretty dank,-1
interesting film musical interruption completely ruin,-1
nellie bly actually wrote experience mental hospital faked insanity book called day madhouse suggest anyone read tragic werent faking insanity witnessing wouldnt changed course mental health care like story got also made movie thats youtube,-1
really scarier real test score test parent see instantly instead big break emotionally fortify score,-1
unfortunately wasnt able make live question resolve shadow past phoenix seems waste restrainedunrestrained status mechanic sotp say forget,-1
guy call zlatan zlatan one time,-1
card slot way harder open oled suck people like short fingernail never issue original baffling changed,-1
teacher nothing infinite cube dare defy mortal,-1
brit definitely cook like cheese cake one first thing taught make child stove oven needed,-1
im surpised actually got greek definition right instead christ cristos second later get wrong devil son devil defacto,-1
transcript literature review essay research paper literature review part essay literature review part research paper maybe standalone product youre master degree doctoral degree program regardless whether part research essay standalone product one thing literature review doesnt prove state illustrate collaborate develop main point thats body essay literature review provide body development section affect paper well heck well literature review divided following key term first whole idea heck literature literature simply major work published narrow topic remember said narrow topic going reviewing every published thing broad topic like steroid use athlete could narrow topic like steroid use high school affiliate steroid use baseball player going reviewing major work narrow topic thats first thing need know literature published peer reviewed source narrow topic second thing literature review narrow topic source published going reviewed heck review well review simply way looking something taking snapshot snapshot going capture snapshot going capture major concept major point major outcome major whatever source going detailed write source going snapshot get snapshot done going show relationship snapshot talking relationship probably going pulling kind timeline situation maybe key year youre going extracting major element relationship among major element may time line type situation next thing know going reviewer theyre hack stuff well think three reason probably youre stuff school first one course improve understanding undergraduate researcher coming topic discipline undergraduate level first link build understanding build background build expertise particular discipline subject discipline course paper built expertise knowledge particular subject youre going demonstrating knowledge demonstrating expertise professor college assignment know real purpose literature review reader service something favor reader bringing date whats first thing old friend ask hey year fill update thing literature review feeling updating bringing date start present see im saying bring along timeline path letting know key element major concept key element life dare boom start dividing line literature review rest paper development go idea past scholar past researcher boom come idea,-1
skipped important step helpful,-1
dont know really people expect workplace pay k month minimum salary chill play game course going stressful hard,-1
moment started talking shit camera fell apart lol classic overconfidence right,-1
anyone investigated fbi qualified president united state donald trump august,-1
united big transfer problem right literally everyone football know bad situation united mean alot good player simply going refuse go regardless much money offer haaland good example player get club play know desperate naturally gon na jack price get money money possible,-1
poor viserys he good dude suffers human flaw almost everyone suffers he adverse hearing harsh truth even brother,-1
think couple inappropriate joke course year harrowing experience must live sheltered life,-1
well thats costume didnt know could sexual,-1
leave alone absolutely agree another example federal government f ing thing,-1
like jane thought hero call everyone looked embarassment bad even subtrist got character,-1
derrick pad forehead,-1
ben show kind rough watching stuff day day,-1
still amazes country even charming cussing beeped away shock sensitive soul public deceit dangerous rethoric violence promotion tolerated put display broadcasted enthusiastically,-1
said would throw document away end night people would go trashcans dig document tape back together said dont believe would destroy document,-1
swear god every exotic pet question answered word know domestication long take,-1
even beginning story stressed death valley incredibly scary go path youre basically guaranteed get serious trouble,-1
people like talk torturing tree like dont cut grass every week,-1
pretty much apple device vulnerable,-1
disagree here think real problem islegitimate law firm good reputation dont want remembered agency represented benedict donald,-1
wish amazon would horrible ai selfpublished book niche hate rip blog reader time,-1
homosexual gay mean he wrong,-1
andrew tate like uncle think he giving really good deep advice reality he series broken marriage kid got taken foster care refuse believe he got drinking gambling problem,-1
world laughing u slowly split country apart people abused power long,-1
ww dentist pacific working surgeon japanese soldier attacked position told wounded retreat held base died body surrounded dead body japanese,-1
amazingly quickly ronnie became traitor minute,-1
whole idea interchangeable battery keep going steel series exactly reason xbox still us aa battery controller think undervalued decision xbox,-1
video exactly doctor ordered guilty im overly fake trained puzzle overconfidence overinflated puzzle rating online game im getting as handed player mistake time major reset made post cheat sheet mistake keep front play future online game time get back completing opening course chessable thanks levi,-1
price today bike absolutely bonkers doesnt make sense whatsoever compare motorcycle even car,-1
worthless movie screwed sound track dont even try,-1
aftermath recent asian financial crisis many blamed international institution corruption government flawed macro microeconomic policy causing crisis also unnecessarily lengthening deepening turn century economist developed world believed major economic disaster thing past least relegated volatile emerging market financial system rich country thinking went sophisticated simply collapse,-1
far shoot kill go trained aim center mass body lessens change missing however actually better severely wound enemy soldier outright killing reason others could fighting otherwise engaged valuable task care transport injured soldier thereby using resource personnel cold sound dead soldier becomes supply problem,-1
mcconnells goal become senate leader listen act selfinterest good american he supposed representing think care white house american interest care like narcissist president would impact power mcconnell refused job year sitting bill american want passed refusing act fact smugly crowing mcconnell like trump angry lost position focus concern getting power back congress way long he secured million day glory removed office,-1
jones didnt purpose still everyday trial,-1
delivery definitely illegal unprofessional love atozy truly hope win much evidence going dirt bag shouldnt win,-1
whenever republican say raid interviewer need respond executed lawful search evidence crime obtained legally counter hillary email need reminded trump office four year failed lock inflammatory phrase,-1
ive telling friend past couple year going see fewer aaa game game compete new release preexisting game well much competition industry,-1
thought end game depression hit hard,-1
ever wonder people go creepy building take picture,-1
im gon na say knew song actual meaning either lying lost innocence early case rip guy,-1
sorry year old child yr could partying midnight way hate love later,-1
interviewer look naive cant argues water avoids laughing,-1
fact people even x cube beyond watching guy x half hour blew mind another level,-1
really difficult work data scientist every company different expections data scientist day data scientist know skill like computer vision deep learning operational research machine learning sql many must discrete line data scientist work role also mentioned interview prep really difficult need prep scratch struggle datascientist,-1
please turn english subtitle first time eating many sausage instagram facebook tiktok bilibili,-1
bank hate crypto people prefer usdt wallet instead usd bank account,-1
everything accuses opponent publicly video openly supporter say doesnt happen cant argue debate ignore stupidity level average republican citizen least far deciding charge,-1
former military officer fathom sabatini ever passed background check let alone became infantry officer action comment classic example conduct unbecoming officer need resign national guard destroys reputation,-1
whenever see company announce release date never take seriously anymore almost expect delay,-1
reporting bad president authority declassified document single one document classified better,-1
many mistake explanation,-1
life man even,-1
german really hand soviet beachhead fortress city bombed rubble became nightmare advance,-1
youre middle ground invasionoccupation neighboring country dont feel even little ridiculous complaining someone ruined navy parade,-1
scott literally killed drag back like kid used force field playing army school wow fuck get many like guess yall lot goober school,-1
though reminding horrific time past might console u get pandemic cant deny definition catastrophic different everyone inequality huge rosy picture showed probably developed nation people lost job life dignity even democracy time period set limitation challenge different,-1
candidate participant train hardest ever able play magnus title magnus,-1
call gan cube regular cube wait thats illegal,-1
terrifying couple day ago talking friend went music festival security didnt even check bag kinda scared event like could easily target mass shooting,-1
think casemiro quality player quality singing dont believe hell unmotivated he everything he world class cdm need madness well paying money point window crazy reek absolute desperation,-1
really made sad person great dedicated work time expense terrible relation wife childrenits freaking sad never,-1
dissapointed animate dimensional graph would make thing easier,-1
sophisticated entertainment empty headed news report wrapped constant reference freedom sound like america,-1
lmao karma sitting like laughing,-1
one really important point ionizers produce potentially dangerous level ozone due negative ion create air id cautious air ionizers unless advertised specifically bipolar ionizers one recommended produce ozone harmful,-1
wish provided better example,-1
yeah insane lawsuit super laughable lmao,-1
fair criticism side however online chess played ft away opponent ridiculous,-1
love hate relationship console exclusive get exist draw consumer specific platform coming phil along xboxs track record concerning exclusive since around havent exactly praised playstations corporate weasel word xbox cannibalized quite frankly wore golden franchise halo gear war umim sure im forgetting others line going get blurry title respective console manufacture game end consumption xbox really well game pas missing killer app system,-1
im data analyst say need good attention detail actually know skill set one wrong variable skew result majorly cost time money ive bite bullet hurt wasting hour life something need redone straight abandoned,-1
minecraft game bro emotion,-1
point order didnt accidentally harm kill million people others knew consequence action prepared others py ultimate price piece silver greed continue downfall mankind,-1
scary part there handful techno dork making policy ai affect life im worried human behind ai ai,-1
one annoyed borderland obtain play online someone gearbox someone already trophy changed rerelease playing three player,-1
nostalgia personal thing said dont ever see nostalgic nintendo switch sport,-1
u security clearance serving military know truly serious mishandling appropriation classified material,-1
video quality bad hard watch,-1
legendary pokemon elusive find even difficult catch usually obtainable finishing main game nonstop rumour dubious method obtain underneath truck etc vvvvrrroooommmmm,-1
many pot smoker let people prison weed related charge,-1
imagine television network making sort program day rather depressing rather recent u time worried dumbing culture yet still plenty high brow culture covered main stream medium retrospect may last era high culture would part play television,-1
time dump lrcx guess,-1
alexander died back injury carried team much,-1
background music loud distracting,-1
recently got impossible cube showed end regular rubiks brand popped sticker fall right box believe either dont give shit theyre still largest theyre incompetent,-1
never thought movie made without chadwick boseman still feel incomplete nothing done ill watch movie man left legacy behind world went eternity rip chadwick boseman black panther forever wakandaforever,-1
lol kicked fail rp even tho cop also fail rping,-1
bald doesnt mean mad everyone,-1
socalled turtle snake hoax thing real blurred fish gut rest said likely cardboard andor papiermch,-1
loop hole death stranding made game pas pc already commented owns pc right theyre free put anything want sony owns console right d probably never come xbox console unfortunately,-1
india even th class exam come harder,-1
damn one hell year old developer,-1
attention food wishers scam alert account name youtube offer prize special deal unless message account fall scam people using similar name thank,-1
watch im depressed career,-1
fact found jimmy hasnt eaten week place full candy make feel,-1
read barbara walter civil war start would know two issue lead violence anocracy factionalization democracy dont fight authoritarian state transition one system hazard found thats anoncracy faction book mean people sort ethnic sectarian attribute rather policy preference sorting creep entire life weve course since tea party started cure doubling democratic participation gop pointedly anywhere theyve got hand control steered right ditch im glad least one five u say thats problem face,-1
want stop talking dump soon indicted tried convicted imprisoned appropriate according law,-1
accidentally bit generous considering knew danger intentionally covered,-1
first game felt like flash game second felt like full release third felt like one unity game fun physic overall thumbnail clickbait poor devs definitely heavily underpaid work dont think would happy giving little money work even giving credit either,-1
lost real savage bitch n reason cried felt rip king von,-1
would make joke gravity noone would fall,-1
downward spiral country scare every single one u well u actually know history kind nonsense lead scary indeed,-1
always remember cant operate army without supply truck also fuel truck destroy capture russian truck armored heavy weapon army truck driver high skilled soldier puncture truck tire damage engine,-1
dont normally watch like kept attentionuntil endwhich suck unless part many question left unansweredi hate ending,-1
conte chelsea friend devoted foe colddddd,-1
got second already call bullsht paused video comment started reading comment amazed every comment show disdain medium including cbs news smh caused forget original meaningless thought,-1
teaching child wrong thing school creating societal system section dependent upon section mean one section fails rest also fail need teach child independent instead teach child obedient worker give meaning someone life teach grow food build house repair car cook meal eat stay healthy importantly meditate pray give life meaning,-1
sad thing posted year ago nothing changed school system,-1
heck ended usa went frying pan fire thing easier u really nowhere run nowhere hide harsh reality trying survive socalled modern world maybe uncharted island middle pacific bring food booze though,-1
ive trying go active ftx u past four month time try reach support go hoop put detailed information problem get canned response address issue shame plan using cant get set cant use successful guess really care solving something important im boarding new customer,-1
trampoline park done jumping decided play arcade game ticket one game got first rubiks cube really bad maneuvering would cause much friction decided try move really fast back forth literally blew piece middle parking lot scattered everywhere midday spectator around safe say could never get back together ended buying several speed cube im able solve,-1
boomer smoked weed year people age arent always truthful whether smoke,-1
soo let get straight person refuse reveal identity point tell fishy story point without proof point joke wasnt even sexual harassment point revealed tragic story kotaku point yeah lmao cant even take seriously,-1
unbelievable many people get away,-1
immature reason entertaining probably incredibly easy avoid troll like people get mad rather handle,-1
whatever happened communicating threat charge fbi charge people regardless feel meaningless fbi afraid arrest people making death threat happened government,-1
brain hurt decision watch still regreted,-1
isnt mayor america much power cant become acting mayor youre someone mother cant chief police youre mayor cant arrest people hold custody reason lack cohesion cant head hurt,-1
learn youll never see walking forward,-1
foodie beauty actually terrible person context behind video cheat meal boyfriend time got woken get ready eaten salad cottage cheese night believe yes ate wasnt fulfilling prebreakfast genuinely vile iykyk,-1
