Comment,Sentiment
whenever get people young enough actually understand internet giant tech company might broken long year old senator asking tech ceo internet work nothing get done,-1
president ripped document taped back togetheri never saw intentional destruction document saw document handled ordinary course business might defaced fixed ripping document considered ordinary course business he admitted defaced,-1
classified document compromised may well tell damage start looking copy planning blackmail local government foreign,-1
defamation suit made image worse lmao idea till lawsuit laugh man child,-1
multiplayer trophy tied platinum always always worst,-1
really needed weird relationship classic havent even started frankenstein book club im genuinely scared lol,-1
hey erling paralegal saw end video would still recommend getting attorney help handling suit lawsuit fun way unless attorneyfirm cause unimaginable amount stress parent victim certain suit really followed everywhere lingered back mind always moreover side attorney advantage knowing system work need exchanged discovery phase rule dislcosures interrogatory evidence intend use trial deposition plaintiff defendant expert witness etc make appearance compliance meeting judge truly admire resolve stand ground defend careful proceed pay attention deadline need done also remember legal system justice system legal advice concerned fan lawyer legal professional please correct anything may overlookedunintentionally misconstrued p think service guy threw paper rudely fine unfortunately identified happens leave doorstep,-1
post game depression never really hit undertale every chapter deltarune dont know im getting old soft theyre good,-1
excuse lobster talk,-1
considering well nintendo exclusive sell hardware especially switch find phils comment laughable,-1
chat going crazy see reaction chat completely incomprehensible screaming,-1
first sentence started liedid mistake purpose accident reported matter course year numerous time wasnt intentional asked question ohhe lied guy never admit wrong morally compromised nothing else,-1
guy existential crisis whilst speedrunning popular game altered educational purpose,-1
decided google day ego heard there possibility company applied google employee often first thing come search name place volunteered almost year college campus didnt attend anybody similar problem fix,-1
damn man im seeing physic face changed damn havent watch year,-1
nation going back sincere governance election partisan nature governing supposed encumbants tasked address need citizenry job leadership never retard nation progress party doesnt hold majority lie one upmanship got stop victory seen nation rather one party job serving facilitate progress much better may fallen short ideal never stop striving guaranteed make quit,-1
hell get end working buzzfeed,-1
game season might seem like bit soon worried liverpool team early indication liverpool midfield literally paper thin come resource long time lfc supporter cant help compare decision let sadio mane go situation xavi alonso year back think j klopp going put serious time working squad get anywhere close top position year hope wrong honest man utd halftime,-1
man levy mvl podcast take massive dump mvls opening black,-1
fearsome predator sea shark orca literally torturing animal fun joke,-1
honestly chandler darkness genuinely crazy pure darkness make someone go mad,-1
ivan toneys mitro celebration probably lil awkward,-1
binge eating issue horrible lately totally relate candy,-1
imagine current gas price right,-1
really expecting really messed ending wife actually never loved something like didnt expect wholesome ending great stuff,-1
life saver got stuck pretty bad teacher literally wouldve failed exam wasnt,-1
really headed music entertainment like artist real human mean could possibly go wrong room full white guy conjuring ai black rapper,-1
first ive questioning jperm know name second rich,-1
waste time,-1
good thing know exactly blame hold accountable violence manifest gop rump,-1
like man solve damn cube second year since last cube still cant even solve,-1
agree doesnt make sense someone go comedy show madin reality comedian stress reliever,-1
cant even imagine poor warthog gone air mr narratorthe air,-1
ac super annoying first released pas mission first time without retry problem control clunky af goal mission time annoying without much logic like touch water,-1
khng bit sau khi bt trong video n th serie sau mnh c b n h nh khng,-1
hate say hope dont sound ridiculous dont know man mean could walking street wouldnt know thing sorry man,-1
one ask took taken long get back people helped take document held accountable,-1
could much better useful,-1
arun product killed hundred people also arun,-1
nothing hybrid warfare call terrorism simple plain cowardly terrorism,-1
window breaker seems like easy way rob someone car,-1
everything come man mouth literal gold,-1
greatest concern biden remains office another five minute,-1
imagine scammer get hurt someone point win,-1
searching google earth see random thing could find found many beach antarctica random block shape definitely natural covering lot little island much altered covered make wonder actually going live,-1
love irony people know fake speedruns could fake like fr people think fact vids themself might fake,-1
population mass psychosis,-1
who laying bed watching hungry asf,-1
would give client yes code want disbarred like rudy honest lawyer defend po,-1
ive reading republican feedback totally fine trump take government doc long dont contain sensitive info fine trump keep doc theyre safe mar lago security enjoys sound right,-1
parent need go jail allowing daughter allowed r kelly,-1
company accounting dept possible,-1
deleted thumb,-1
problem telegraphed well general user access mario kart track example need upgrade ux put switch online section o also message better guess saw see load people arent taking advantage downloading dlc part sub,-1
much fact dont know movie make mad disrespect showing towards animation get mad people worked hard draw film hand drawn animation cell animation tough compared computer drawn animation lot animation movie still hold,-1
course appealing divorce settlement made without even room judge told opposing attorney lied dont go outside settle man ill make sure never win another case court long im presiding judge yes folk happens order get pencil whipped time,-1
biggest problem right im working day try study catch bus go work work get home walk dogeat dinner start studying wake hard find time,-1
always want unlimited dataset machine learning sometimes want limit dataset example youre trying figure youre stock market recession expansion dont want go year month data youll end another cycle symmetry domain limit important machine learning point sometimes much data waste time resource,-1
loss knowledge issue preoccupies common day even regular company time something break one know fix last guy knew left company ten year ago,-1
order save economy everyone must go buy folding phone sign streaming service get coffee every morning new ev throw away perfectly good hd tv buy bigger k tv thats really company want,-1
bill exact opposite called thanks sleepy joes policy x gas grocery price inflation drop annual real wage condolence anyone like retiring year year nonstop work crooked system swallow earnings,-1
expert oknot alienbut reason give prove alien ridiculous,-1
part standard american history myth believe john adam thomas jefferson founding father didnt attend constitutional convention bad,-1
subscribe ill drop kick,-1
funny enough mukbangers claim viewer love hear smacking yet comment read contain complete disdain sound never loved loud openmouthed heavy breathing vid,-1
one saddest lesson history weve bamboozled long enough tend reject evidence bamboozle longer interested finding truth bamboozle captured u simply painful acknowledge even weve taken give charlatan power almost never get back carl sagan,-1
apology watching whole video former student parent student know system broken long common core remember college english teacher give grammar guide deficient basicsthough well english school take remedial math high school didnt prepare college coursesthough graduated required credit thing gone since student kid school high standard low expectation mean lot advanced class offeredlike calculusbut many way accept failure take history social study pas one policy child left behind additional failure meant one failed held back even though wouldnt graduate time kid left education limbo earned enough credit ousted much government involvement mean teacher arent allowed teach phenomenal teacher underpaid far much nonteaching responsibility heaped school arent expected educate student theyve got feed clothe teach manner get along look abuse deal special need accompanying ieps head bullying deal allergy medical condition worry gender identity sexuality discipline fairly deal helicopter parent check box college prep deal everpresent worry school shooting expecting school teacher wonder anyone go profession stay see outlook common core like child left behind great idea paper fails implementation kid went school time policy insure teacher welleducated push make go back college additional course tested teaching student meant even testing studentsto judge whether teacher task time removed lot incentive teacher betterlike tenure promoted best teacher classroom took away teaching assistant due cost increased class size started charter schoolswhich experimental program imagine billion spent common core used pay teacher moreand get way,-1
never imagined ssundee playing chess,-1
ah colonialism destroy cotton crop specie highly valued replace poor lowvalue alternative eventually recreate plant hold market monopoly expensive product great job,-1
eye second con worst thing happen ml many case would eagerly wait hour model train see work way intended id keep training model day day making small change code see performance getting better,-1
he actually underrated,-1
regulate college tuition doesnt happen please otherwise pointless,-1
motion alarm protecting laptop make laugh taking break away workplace really think alarm feature would deter thief simply knocking device floor pick laptop perhaps step alarm crush moment disdain time get back latte phone notifies impending bad luck laptop extended trip,-1
earphone get tangled time mile mile dna dont mind blowing,-1
dude think wage increase cause inflation massively inflation people payed less value year year since mass printed haulted production service filled balance sheet took massive amount debt wage increase result dilution cause,-1
updated mine tired lazy wicked human being enjoy taking advantage everyone specially elderly many scammer hacker foreign domestic,-1
askgcntech two year running tube finally went tubeless couple month ago managed puncture tyre day sealant didnt trick couple slug even tried patch inside tyre puncture sidewall may mm large given tire plenty life left gutted may discard tire would come decision tubeless tire ko,-1
wise man said thats lot damage,-1
quality player casemiro also dm weve cried concern signing though much motivation still achieve everything multiple time madrid said pay eyepopping k week ive heard thats typical united one biggest problem paying insane wage resulting comfortable unmotivated player cant move time say quality player seems like one may help stabilise u bit wont help u achieve anything substantial pulisic ive always quite underwhelmed albeit see possess good quality probably wouldnt averse loan though cant worse banging head brickwall hoping rashford anything productive every week,-1
hate company need innovate u always creates problem bloated operating systemsfor u microsoft worse,-1
know full well theyve shown repeatedly dont care constitution law hold accountable law everyone else pulling everyones leg simply literally game thats abuser,-1
dedication use one pole lightsaber start breaking stuff insane,-1
hey something might interest couple day ago amazon account closed warning hour wasted time theyre telling excessive return think error thats beside point closed amazon account amazon device year primarily echo device stopped working lost access amazon photo prime video pay apparently device already subject disabled amazon perceived shopping habit assume applies amazon device service like fire o tablet ring camera probably aws well wanted make people aware definitely dont tell buy hardware service,-1
im jealous cool vegetarian option,-1
shame scott waring ever find something legit nobody believe credibility irreparably shot,-1
video doesnt even mention humor abundant alongside tragedy darkness,-1
amount effort guy put video insane,-1
universal hate printer unites humanity,-1
he rich cant afford better quality lol,-1
term limit must tired crooked cryptic politician retire,-1
party would already could even melt candy,-1
actually came year ago damn time fly must admit business listening music like young age classic who still,-1
technically ramp buggy isnt suppose used offroad vehicle street vehicle thats classified offroad pretty much buggy ramp hood windshield,-1
monthsand time reminded war going,-1
tolerate disrespecting brother nose candy,-1
imposter syndrome real think tie back lot first question u imposter syndrome dont realize everyone else working hard,-1
ram allocated game devs nice doesnt solve one biggest issue series bandwidth memory also ram doesnt really mean higher frame rate higher quality texture asset increase distance see lod culling isnt going affect frame rate going might allow stuttering inconsistent fps hold locked fps,-1
lamda feel like im falling forward unknown future hold great danger well thats exact nightmare year old,-1
people want worship one man word previous action point buy stock command elevated price damn fault,-1
boring almost fell asleep,-1
bad mother herobrine,-1
experience drifting issue largely caused dust blowing stick compressed air using alcohol clean appears pretty decent job fixing issue still bullshit deal though everyone lucky may need get stick repaired,-1
movie explains kill need make afraid ever turn need face fear fight back pennywise realises arent scared begin starve feed fear starves weakened finish good,-1
perfect storm brewing america inflation sever drought farm belt pandemic food shortage diesel fuel heating fuel shortage baby formula shortage shortage price available car price housing coming together could lead real disaster toward end yearor sooner,-1
impossible nothing like could ever made,-1
trying metal icewhy water test like metal,-1
begin procrastinating actual study learn something different crash course,-1
could break right glass leave alone gun floridian thing ive ever heard,-1
george stop thinking btc crypto going go macro economics getting even worse wont see anything big fed pivot btc halving get closer,-1
code work idea code doesnt work idea,-1
personally would switch place metal smallest lose thing easily especially tiny cube,-1
jimmy last one leave star hotel win chandler hotelaphobia,-1
dave dancing empty theater make wan na cry,-1
titled search literature review write one,-1
note souldiers revisit patch fixed lot worst issue fire temple late game area still prone lot crashing saving dragon sword every time saved dungeon whether would crash didnt get crash anywhere else im sure area specifically problematic also area one room particular game breaking performance bug big patch,-1
musk hater said laugh salty rn,-1
disagree david admire obama speaking truth thats rare day im uk sadly see kind politics immoral discussing,-1
remember happens give unaccounted money weapon country fight proxy war keep making mistake,-1
learned video confuse enemy weird move something dumb,-1
wasnt even planning voting midterm woke everyone,-1
fan switch useless haha here dust cover,-1
perisic brought much offensive danger wing spur deadly considering someone kanes quality waiting header,-1
since grox fired powerful weapon joofy probably thought joofy worst job entertain hopeful dancer would win,-1
subscribe liked video elon musk end apple domination elon musk destroys apple elon musk delete facebook elon musk v jeff bezos getting worse every day elon musk life k priced small house,-1
gmt dont think prepare game adhd wanting make metroidvania style game visible sadness,-1
one pain often feel never know caused absence,-1
mace messed time signed snoop omg,-1
care dont anything hide mentality get awful privacy violation like patriot act,-1
there chance half viewer video probably dont even know nextbots origin,-1
usually russian say foe something inhumane clear sign commit crime,-1
didnt realize k per family consider low income people making way less paying forgiveness plan administration insane,-1
slow hirings may caused rapid rising labor cost hi tech ind,-1
video child shocking alltimeml mr dunn respect,-1
fear others suffer every time get car,-1
education learn mistake school get mocked mistake,-1
thank addressing declawing cat awful hurtful cat,-1
bitcoin durable electricity network connection time crisis many place around world thing unreliable also key lost bitcoins associated gone forever,-1
great see including wider variety stuff video beyond electronic device especially pharmaceutical industry youre going include banned medication top list next video thalidomide absolutely tragic banned decade ago yet people still suffering living severe disability day thousand family destroyed life lost,-1
em toda minha vida nunca vi uma lev de jornalistas incompetentes e despreparados como que temos atualmente,-1
part stick older console server network logins drm stuff ruin gaming like popping game playing,-1
someone correct clearance vouch like many guy didnt keep place meet requirement storage material also lying quick dismissal clearance ive seen people fail get adjudicated omission one piece information thought wasnt important one lost keeping touch mother china contact mother caused lose tssci think guy follower think nothing wrong level failure former president show illequipped handle said document one excuse another day day people live real world clearance know effed time put value claim action republican dont claim convenient,-1
reading comment agree felt ripped decided search fattest giraffe many copy particular photo squished spread make look even fatter yet also one sitting someone hand suspicious know amazed find overweight tiger one animal would expect get fat also huge prairie dog fat horse animal labelled morbidly obese could turn,-1
sorry richard family hope find strength need go process,-1
thought foreigner one earning,-1
nose stash look like combo glass,-1
ive seen google map car couple time little remember like damn like new kind car remember always talking friend like would always think missed like lolipop giving away sum,-1
really dont want rerun presidencyhes club,-1
state deregulated tuition fee college could charge used money hire administrator build building student paying education also paying thing college wanted state want give money nobody talk,-1
tell u looking universe wrong end telescope,-1
suck remember playing actual game pineapple pen always frustrating didnt get pineapple apple pen,-1
fit definition slapp suit strategic lawsuit public participation strategic litigation public participation lawsuit intended censor intimidate silence critic burdening cost legal defense abandon criticism opposition,-1
case king john ive always found funny bad job entire country completely restructure government,-1
half comment video lol guy think sat hard wait til learn insert random country standardized test discussion surrounding video shouldnt mine harder therefore better bad standardized testing really isnt measure intelligence taking test,-1
grandfather fought german side beginning bitter end battle spent month working inside gulag miner finally escaping day unit signed execution never wanted talk much war story comrade struggle survival guess felt ashamed suffering nazi brought world remember day asked didnt say anything grandmother took side told never ask stalingrad,-1
fact balan wonderworld breath wild came year apart cost make unbelievably sad,-1
principle nitish,-1
theory karl trying help player like mothman brings destruction death,-1
smh much food aggression could stand share raggedy fry way id get attitude husband fry,-1
video definition youre ugly youre poor,-1
lost make u look like extremist democrat hell people respond direct question behavior without trying deflect democratsi agree m claire talking democrat trump would say take bloody responsibility,-1
see pain face he joking divorce hard painful people turn back compound wish well,-1
michelle privilege fly maverick ellie tell dad legit spat tea choked one mavs f unable fly demo pulling g damage structure aircraft many g break airframe immediately even pulling less limit still damage microscopic crack build time invisibly weaking airframe break sometimes normal nonextreme flying combat aircraft rated glife maximum cumulative number g pull life theyre retired precautionary measure mavs extreme maneuver demo may broken f immediately may used much glife effectively scrap anyway,-1
dude literally punched nut squeezed lemon eye thats man respect,-1
russia beaten highspeed attrition warfare alarming russia throwing away best life equipment victory ukraine,-1
didnt even know sat sophomore year parent didnt know much school system worked im oldest first,-1
poor guy going costume party costume cost lol,-1
macbook pro literally died last night id say im safe,-1
opinion lot people trouble,-1
looking dont know wrongdoing suspect dont know find dont know justified absolutely tyranny know care utterly stupid reasoning,-1
feel like im simulation point,-1
im team tutorial less haulsunpacking learning make make feel better seeing people buying lot makeup show make feel even poorer maybe im jealous cant afford im sure im one feel way,-1
biggest problem college charging outrage tuition fee causing happen,-1
polygon token lost utility since longer used gas fee tell u youre still buliish,-1
point dont think credit card company care anymore,-1
nation expects ignorant free expects never never thomas jefferson,-1
nahh klop losing match excuse,-1
ptsd nothing violent outburst along line unable stop thinking saw happened keep thinking event eventually start living life avoiding anything might remind happened get stop replaying head different level avoiding certain type people avoiding group public transportation case avoiding people altogether violence normal response many stressful situation people ptsd arent violent anything people go way avoid violence confrontation guess stereotype arises people turn drug especially alcohol help stop thinking happened alcohol cause violent outburst idea someone mistaking enemy attacking myth least ive never met anyone like experienced anything like dont real flashback like hallucination stop thinking happened happened could stopped etc like anyone traumatic event issue usually go away bit ptsd still keep dwelling year later,-1
foodie beauty horrible human,-1
nearly enough episode series groot deserves,-1
negative ive streaming game image quality quite lacking game look better others tho cant beat downloading every graphic related file,-1
reminder guy said charging portable stand useless switch kickstand,-1
phone everything claim apple taking real big hit investor,-1
think worst year born would involved two world war spanish influenza great depression turn,-1
need metaverse literally make sense pushing hard,-1
wish developer would realize forced drm internet connectivity game step backward look debacle gt simcity endured whats point paying full game guarantee play leisure especially ridiculous requirement place singleplayer mode opinion point cant help wonder spending time game either fun another full time job people play game,-1
computer science treated like science based subject physic chemistry biology shame school dont take c serious subject,-1
kevin de bruyne insane newcastle need taken seriously season,-1
dont click youre kid,-1
ok ten minute break time ten minute power cry failed reading section rushed running time,-1
people paid debt people immigrated usa legally slapped face people pay debt,-1
one friend gave monster hunter rise got overwhelmed mechanic interact pretty much tutorial especially weapon work movesets veteran really longer think reminded gradual introduction main mechanic game turn many potential player away,-1
im playing shit time already boy str smoke,-1
theory karl creation made dev supposed help gone wrong trying hunt player scare,-1
bio teacher wellknown paying attention class except chemistry end year giving candy class apologizing shitty teacher course nothing raise grade class video thanks much yall helping understand flipping course,-1
bad editing jump around much,-1
government held accountable pointless expense war already genocidal turkey helping still lose end money could gone peoplegovernment took month vacation send u measly dime covidbut billion send whim,-1
year ago going university america free corporate america took advantage educational system problem educational system america middle class poor family going university america lifetime debt,-1
reminder fall fake telegram whatsapp account trying claim prize texting fake scam personally contact winner official account,-1
something ive noticed alien spec bio thing dont often see structure analogous fur feather critter wonder,-1
cash tencent make revenue annually xbox nintendo combined make zero exclusive saying pay support devs like saying youre glad pay gas pump support exxon people working refinery dumb,-1
never thought id see day gq would post wave tutorial,-1
