Comment,Sentiment
fact raphael warnock leading four point allow world see something wrong voter united state,-1
younger year guided flyfishing alaska looking window float plane sometimes id see pond almost looked like boiling natural gas coming permafrost arctic region europe store natural gas need utilized measure self sufficiency energy independent security idea havent thought crazy rely country harbor government brutalize citizen good business turn back bully school smiling nice one thing bed evil another,-1
prop knowing throw,-1
people either love hate see man great opportunist understood world work tell worst institution run today men hide bunker fought men gave epic speech rewarded staff troop greatly gave men reason live even self motivated listen people british hate sound envious yes plunder church didnt kill clergyman uncommon war historian hide behind crown corrupt revolution followed bro power wealth always corrupt people wanted violence free healthcare take hike napoleon saint rather country empire lead patriot international court,-1
offroad test truck swamp next military base,-1
good something got time think american good war,-1
way rich kid kept closing eye making extpresions making threat made cringe,-1
feel though spur overwhelmingly great compared top team bpl make deadly continuous pressure effort show around nd half,-1
making separate comment one thing didnt mention exploding vape part video counterfeit battery mentioned faulty battery poorly designed vapes think big one left people vape seek battery known reputable brand however there huge problem cheap counterfeit imitation battery sold original brand name even place like amazon amazon huge problem counterfeit product sold website really tarnished brand many people eye,-1
scary doctor perfrom radiation surgery villager minecraft scary villager,-1
youre telling person didnt weird fascination ranging people intelligence kind scalemeter format wouldnt stress sat much,-1
get ice jeanelle sorry ice machine broke,-1
late game joe bidens office little year half late game,-1
arrested charged retrieved first box guilty would allowed rip place apart look anyone else taken record would prison life trump went took back trump want first place,-1
question committed crime immaterial starting wrong premise conform justice principle investigation rather question crime committed crime committed law say committing crime justice follow law say unless person former president,-1
drafted starting pay per month got married later year wife allotment per month twice base pay injured role support certain civilian agency violating law southeast asia called liar threatened court martial proud service country service duck,-1
first got fired tried steal anything nailed running around yelling stop steal,-1
first never cult cried planted document think hisyou cant make stuff upindict indict indict indict,-1
question drm appy anything played switch upcoming title need internet connection play switch im always connected idea might case drm make switch unusable another console generation two,-1
heart go richard engel literally cry eye right yes im man sad richard lose son im sorry lost richard hope take time family god bless family,-1
calling someone racist phobic evidence back show true ignorance,-1
month get celas soon heard fed looking pulled,-1
stephen face gaga said assaulted made tear gagas absolute spot description trauma made burst tear,-1
trump played right garland hand,-1
jimmy done challenge starving day lmao,-1
targaryans history putting lot stock dream reason house survived doom valyria one dream would happen packed went dragonstone even game throne dany dream stepping fire hatched egg thats problem watching show criticizing certain character without book context,-1
fell bad randy got violated hard,-1
cute obviously dog feel bad,-1
note screw driver put extended bit smaller precision screw driver set common screw deep hole small bit hex end wont go far enough hole extract screw see allot laptop controller kinda thing sunk screw suck,-1
remember saying interview dont stand behind anything he shown u believe anything say youre fool released tell follower look privacy right release info,-1
remember vaping purely prescribed recovering smoker year ago friend mother vape looked exactly like cigarette recommended proffesional see middle schoolers sharing parking lot school,-1
lazy make ice cube bro pour water tray leave freezer thats apl,-1
someone high school refuse listen teacher even refused read book anymore student suddenly want listen teacher read book something wrong somewhere donald,-1
kayaking father florida took break rowing beautiful dragonfly landed end ore second gawking went bigger dragonfly landed top first proceeded quickly rip head decapitated new found friend took body leaving head sitting ore jaw floor total shock murder witnessed day learned dragon fly metal fuck,-1
know seeing chris hat weird,-1
damn man sharp age granddad bless soul got live age last year deteriorated degree couldnt function sad witness sir penrose almost talk stuff clear way adult arent able amazing,-1
explanation confusing unclear,-1
way said okay told promoting,-1
confirm squirrel fact raised orphaned one sweetest cuddliest pet almost grown woke one morning acted like wild animal biting scratching trying eat face sad day ive checked wanting squirrel list,-1
anyone wanted see something cursed faze non,-1
actually underrated,-1
world history test minute havent studied,-1
would expect spot kind versatility within five year already open door turn know flip switch hurdle limit natural language responsiveness really dont want robot think want put bottle ketchup microwave zap five minute,-1
roast anybody without making feel bad,-1
wonder killed unboxing experience watching every single unboxing review youtube lol,-1
worked low paying tech job six year still felt burn problem tech fast paced competition focused barely keep though got promoted regularly higher ups told truth left said severely underpaid based skill essentially branded one stop shop marketing department technically knowledgeable people oriented strategic maxed k decided jump ship little planned run financial agency husband make k year entrepreneur freedom set lifestyle,-1
summer uk sun deadly lazer winter uk anymore there blanket cloud,-1
phd student machine learning must say dont fooled stuff type ai specifically designed mimic way human interacts others would utterly unable produce new idea opinion subject would essential criterion consciousness,-1
nothing get npc want apologise guy troll npc,-1
get knowing movie literally never heard get liking quality janelle lucas entire personality throughout video let trash everything see devalue every credible thing theyre teen teen video great open minded teen real life open minded well two dont pas vibe wouldnt want watch anything old,-1
hype anymore announced back day phase infinity war endgame two search reaction insane,-1
veteran think back military service oath took weighs heavily right time wasnt permitted say anything wanted first amendment right free speech wasnt stripped temperedthis wasnt abysmal violation right willingly undertook time high time pas legislation hold criminal penalty candidate official knowingly lie face legally established fact precedent bid seek office engaged task office age obfuscation end gaveling wont let th weed grow back toxic democracy isnt ended soon new face fascism take countless life damage unseat entrenchment complete coup ongoing see,-1
ironically trump signed law made felony remove retain classified document,-1
fact gave full head hair fantasy story never funny lmao,-1
feel like doesnt belong list almost unfair,-1
honey pot ant also delicious im told extraction cactus pepper downright horrifying trypophobic sense yet still curious taste,-1
brighton team people actually sleeping ontheyre good standing moment nobody paying attention,-1
good story lead emission automobile effected humanity even heavier amount lead possibly time higher average household time period paint contained extremely high level lead many million infant would set teeth grinding away paintwork side crib mention metal toy liberally coated lead paint plumber used combination red lead paint hemp thread sealer household water pipe pencil high lead concentration hence phrase get lead pencil house roofing lead flashing many home rain water collection tank drinking water could go argument regular household probably bigger contributor lead poisoning people automobile solder usually lead tin combination also heavily used household plumbing well electrical electronic equipment see average home era copious amount lead level blame automobile totally spike lead poisoning would seriously biased view,-1
showed clip reading class im teaching sf bay areath grader one idea came class imagination empathytwo main skill strengthened readingcan antidote cynicism indifference two really toxic aspect culture young people deal,-1
used work online tutoring company wanted native english speaker promised would dock pay thing like yawning screen pace insane fired smiling enough burnout rate high especially get lived america kid would really young youngest tutored young understand anything pajama finishing dinner like last thing wanted stare computer learn english especially age range seemed yearolds sometimes would pick laptop run around room parent would give u bad mark keeping child engaged enough really horrible job company worked,-1
way raccoon got flung dying lmao,-1
youre still talking rumor entire video headline video false information nothing finally revealed,-1
love people interships big company like microsoft google etc country there company like live venezuela poor country want degree get shithole,-1
taking mine tomorrow havent even prepared adequately want start studying,-1
imagine climbing way trying sleep see sleep monster nearby,-1
honestly tricolour three team mode sold game shame limited splatfests felt like mode truly unique franchisepushing idea mode warranted whole sequel oh well guess nintendos server wouldnt able handle moment splatoon back splatoon really need evolve beyond first game quite tremendous advanced way order actually feel like true sequel tricolour mode close principle ala limited splatfests otherwise stay fresh quote sheer irony splatoon thus far proven stay fresh,-1
information get public domain channelized censored people never know laughable allow tv show sell secret whatever share really tell whether whole truth explanation keep away much thinking appreciate concept show binge worthy sure honest,-1
mom wouldve gone nut growing lol big parent fear toxic chemical getting poisoned always lecturing stuff sink making sure didnt touch pesticide farm figured could call pb theyd send mr yuck sticker house barn covered,-1
dude little damn british kid killed nerve ending thing,-1
egg last form inexpensive protein available grocery government incompetence indifference literally taking food family table point,-1
normal person would end much longer sentence beyond wrong,-1
best quality human ability love best quality ai ability think logically two thing sometimes odds ai likely figured immediately tried justify mixing together one simply compassionate logical time time sacrifice lot name love logically shouldnt ai doesnt understand love attachment care either willingly logical even lead suffering order achieve objective word psychopathic ai,-1
one biggest thing people take consideration theyre gon na pursue job anything related c never end youll constantly trying keep latest tech wondering need bring getting newest comptia cert current good enough rough life especially youre married relationship constantly hour front screen,-1
let look consumer point view paying developer fee timed exclusive one thing big deal thats business obviously need reason customer want buy console sony intentionally go way essentially bribe multiple rd party developer block game ever going gamepass ensure customer continues pay full price platform instead know cant compete anti consumer monopoly driven get nerve call activition deal harmful gaming industry talk pot calling kettle black sony answer gamepass whole business model making mass profit customer making think cant go anywhere else simply sony running scared trying limit damage profit inevitably going lose cod guarantee sony big enough company buy activition would done heartbeat bet bottom dollar wouldnt leave cod multiplatform apparently one rule everyone else completely another sony hypocrisy best,-1
cant believe way calculated fahrenheit temperature change made past review change degree celsius change degree fahrenheit temperature degree celsius slightly freezing temperature degree fahrenheit,-1
never let masterpiece die,-1
remember going friend house seeing plastic version thought real trying bite plastic ice cube friend stared shock,-1
fact whalesdolphins legally kept place like seaworld insane given information video,-1
live rural area agriculture high risk business take enormous upfront investment yes food always needed mother nature notoriously unreliable global market fickle reason large corporate entity taken family farm brought death countless small town,-1
whoever motion graphic killing,-1
seen one big spider bathroom sister take bath spider hanging corner wall,-1
professor india every time department would order catering would complain vegetarian option good reason looked nowhere near good vegetarian option india,-1
sony drop software sale lower sale expectation arent even supporting developer,-1
omg pure masterpiece biology part got shiver even though among four im studying right,-1
im getting frustrated chemistry math semester podcast pop perfect timing lex time get fight back,-1
designer universe overlooked possibility specie would evolve enough work wonder make sense quantum level realise well know know imagine actually true,-1
guy pls u saw drone try destroy felt like still got idea drone work let stay still em anyway passive still scan rhapsody ult,-1
thanks owen watching guy lose poop constantly one hand entertaining real damage unsuspecting people fallen rhetoric christian people like make saner one among u cringe constantly expect everyone believe live together need treat everyone dignity human kindness place society kind hate,-1
died one year every square board poetic,-1
cant help someone refuse help,-1
counterbalance deal aerodynamic flutter really incredible biomechanics ive seen video flutter tested airplane joke quickly ruin day,-1
fact didnt buy nicholas cage spoon outrageous,-1
get knowing half battle half extreme violence,-1
little girl blew cover early career,-1
wow really dont want pay artist anymore make ai slave wtf,-1
politician career choice term limit everyone,-1
someone live united state anyone explain country held hostage nation halfwits,-1
first document werent document planted want ban joke,-1
year old son two falling out life time cussed took little time apart eventually made became bros year old daughter ive lost count falling out girl dead half woman wife considers friend come home hanging rag obliteration,-1
going civil right lawyer representing aclu calling honor rep trump bannon weird bag,-1
one said stop cry men cant show emotion gon na follow stereotype like get kitchen cook,-1
like watching video cuz inspiring continue college education highscool gpa student barely putting effort muster c way getting college soccer eventually quit due mental health really depressed didnt motivation anything friend job overall bad state h turned back community college trying get degree eventually gon na transfer yeah wouldve wished better guidance wished could go back change wouldnt made harder didnt even go prom football game nothing overall social life starting change honestly making better person happier seeing guy happy yale motivation brings joy guy smart also admire hard work put sacrifice,-1
mean taxpayer foot bill,-1
fact walter practically cause half film problem yet turn end mention wrong reason right everything,-1
oh ok must jerkwad driving like doctor strange spaceship hell oo,-1
really said good thing sister dad said shell lose savage,-1
would worried apps today collecting crazy amount personal data nobody allowed talk,-1
know im glad live got aggressive case scoliosis would killed year id gotten hadnt major surgery hate imagine many people died condition many others throughout history,-1
still cant believe sony cry game going xbox gamepass cant make stuff,-1
one school computer sorry owner device turned dinosaur game,-1
pretty sure daemon didnt actually say heir day even book implied otto might made drive wedge brother daemon didnt want say anything moment vile brother best intention mind sure,-1
appreciate transparency honesty unfortunate company think control actually,-1
absolutely printing money student loan relief lol dont think bank education system want promised loaned money yea right think theyre gon na take hit yikes poor take tbh,-1
ny democrat never cease amaze mepicking absolute worst representative possible thanks jim eagle,-1
used write well elaborate description super easy pen flowed paper like butter ever since teacher screamed exceeding word limit exam got discouraged gave writing cant even write simple essay school really kill creativity dont let happen,-1
preoptimisation biggest weakness sw engineer kill lot passion motivation project perfect hard correct,-1
could look humiliated victor claim reward stuck side shell looking helpless,-1
almost theyre conditioning mass prepare something,-1
yeah sat unnecessary everyone proceeds get,-1
cut pams horrified expression michael doll scenario crossing line video fantastically timedit kill every time,-1
scammersbots getting much worse using name logo comment trick ever send money someone comment dm careful,-1
im actually kinda nervous cause im taking sat tomorrow studying whatsoever watching give confidence thx,-1
honestly appreciate content technical analysis good find truly baffling major crypto youtubers look mostly pure ta completely ignore bigger narrative btc pumpspumped future outlook even rosier seems kinda irresponsible ignore fact etf launch far caused major dump peak btc already shaky footing historically low volume almost pure whale pumpsnarrowly avoiding longterm bear market emphasis put day tradiing less affected unpredictable nature market made btc btcfrom day tradng jacob carlson insight chartshis one step ahead analysis reach mr jacob carlson ei mjacobcarlson,-1
interest compound becomes problem put graduate financial prison year paid student loan support debt relief hard pay k interest,-1
worked gamestop year far one unacceptable packing job ive seen first console opened likely terrible shape traded common refurbished one panel replaced opened fixed inside bet missing rubber piece bottom resurfaced way second console likely trade tested employee minute console little done theyre repackaged sold,-1
thorfinn screaming lung saying he going kill give biggest chill hear pain voice time hear serious cant want see accomplish,-1
guy sweating bullet like he guilty school kid principal office nailed as wall actual journalist bravo,-1
last week said sell say buy glad never listen fraud,-1
come person journalist slander company say allegation,-1
sad lawyer must consider great honor represent donald trump hahahahah,-1
canadian colorado fry man im jealous sonny people canada jealous,-1
everything youve ever said done accessed taken completely without context used zero accountability absolutely everybody lot hide,-1
greg legit definition light nobody home,-1
annoying voice lucas omrilol,-1
work bank take work home fired happened work president take classified work home could could stolen used u technically book theyre supposed automatically safely assumed traitor removed office jailed life technically speaking perfect world,-1
fear conspiracy really thrive darkness spot find lot people fall stuff simply dont bother seek answer question keep dark purpose,-1
there something disturbing crystal chuck neglecting evan,-1
disappointing captain kidd one pirate could name short minor career compared pirate,-1
alexander sibling definition sibling goal im jealous,-1
tragic someone loses life like dont forget one violence cause another violence young woman father propagated violence came back violence family use brain violence always worst option,-1
bing devs write write,-1
im physic graduate watching expert discussion made feel like sht learn realize much actually dont know,-1
honestly appreciate content technical analysis good find truly baffling major crypto youtubers look mostly pure ta completely ignore bigger narrative btc pumpspumped future outlook even rosier seems kinda irresponsible ignore fact etf launch far caused major dump peak btc already shaky footing historically low volume almost pure whale pumpsnarrowly avoiding longterm bear market emphasis put day tradiing less affected unpredictable nature market made btc day tradng wtrade inspects insight chart one step ahead analysis,-1
shouldnt permanently banned many real account,-1
terrible glad youre going fight back really hope get result deserve hadnt hurt brand alone going damage completely itll fault entirely,-1
there structure random explanation,-1
soo true real situation even dull sake work school providing online class student without considering whether havent necessary access resource malice pervading rural region abruptly,-1
someone wanted take ended hurting one million time,-1
always wanted go financial market get confused fluctuation price,-1
know kid used think cool applies many company people turned terrible ive honestly lost count,-1
sound audio issue,-1
hear want ratcliffe chant united fan selfmade working class root billionaire lived mile old trafford supporting united united owner couldnt write script unbelievable,-1
many people said edward didnt even deserve shot underrated disrespected fighter sport casuals opinion baffling look leon edward quintessential gray man dark horse train altitude epo dope altitude really affected output throughout fight headkick well read calculated incredible,-1
every time guy still say dont know see happens thats attorney answer everything,-1
live volgogradstalingrad veteran saw said battle real hell asphalt repaired pipeline replaced remains soldier still found ground year passed,-1
employee fired company reason giving poor performance lack culture fit trust tell real reason disclosed done company lie hr work company also lie corporation hierarchy matter lawyer start taking bit seriously,-1
think google trying stay competitive tech company probably difficult allow people advance company always working amazing talent hard working people regarding perk dilemma keep working drive vehicle eat dinner google also offer fully remote position think problem employee especially new one see progress dedication employee work tirelessly hope matching progress thus burnout dilemma,-1
thing holding back took min implement classification algorithm data size around number powerful laptop straightforward lot fun size data increase might go even week gpus pay well frontend development decent company video didnt give valuable input make decision,-1
wowat time flooding inside house caribbean pushing flood water mind went gratitude others worse knowing occuring simultaneously hope recover quickly,-1
actual adult never grew beyond juvenile delinquency,-1
youre fired job cant take document premise,-1
stop funding war start funding education health care taxpayer money let people vote spend,-1
making struggling,-1
american citizen dont feel anything political party everything honesty honor integrityyou dont take isnt dont care president republican democrat independentyou dont take government document home called theft thats crimeanybody defending sicker shame,-1
theory plant creature could possibly fungus mutated form seen previously missing person autopsy report video whenever someone dy backroom get covered black coloured fungus fungus said growing feeding onto person attached onto mutating onto dead body given take long time certain fungus mutate even million year best also given time pass strangely backroom seen researcher informational video date looked teleported strange bizarre flash appeared group researcher vanished however wasnt teleportation instead time travel researcher sudden sent future couple month ahead shown presentation video date alarm rang cctv footage showing u researcher guy miracle made back entry gate point artificially created async logic whenever someone dy backroom fungus dead body already reached mutation stage short amount time creature found footage driver died car crash seen kanes secret video car travelling really high speed highway suddenly clipped road due high speed driver wasnt able push brake time stop car thus crashed wall seen footage driver still alive time badly injured seemed crawled way room teenage girl encountered creature possibly bled death fungus grew later entire room mutated form also sounded like creature yelling help distorted sound possible last word driver death room seen original found footage video later pitfall video creature seems mimic sound last victim case even originator driver theory came dont take canon lol,-1
dislike student take note biology,-1
know canadian made list damn curling highlight make cut,-1
eerian tv telling another fed mistake economic doom,-1
email coming bite republican butt,-1
im mexico kill see one national treasure dying also feel much impotent fact cant much c,-1
nothing hurt last step messing algorithm,-1
clear army drill sergeant arent allowed lot stuff country sleep deprivation injury kill actual learning regardless determined everyone,-1
