Comment,Sentiment
absolutely ridiculous try stop anyone reading want theyll find another wayeven kid perpetuation ignorance true concern,-1
crypto make thief piece cake government oversight pump number wallet value go people think make profit invest cash month later price drop cash already transferred offshore account long sucker,-1
wasnt great oxidation event included list worst extinction event killed close prior anaerobic microscopic form life,-1
undergrad computer science im finishing m computer engineering always drive nut people ask assume either programming software engineering try explain like computer science centered around mathematicscomputational science problem solving developing algorithm optimization programming mean applying mathematics problem solving technique problem computer engineering focused development design computer system always get reaction code guy took computerelectrical engineering undergrad generally speaking simply trying make x thing work trying make x thing run efficient possible take several different path become coder there different mindset developed across different discipline anyone looking going school computer science understand learning problem solver first coding secondary anyone learn code master problem solver set apart life career go path going far math coding end undergrad realize barely learned code spend countless hour graduation learning coding concept library framework problem solving skill allow put use hope help someone understand getting,-1
thrift shop cashier random unrelated junk martina goal beyond understanding,-1
dont know say moviejust hell think wasmayor assassin crazy moviethey need lock as wont evil power anyones life,-1
ive allergy tested one way tinglier especially without spike severe itchiness back,-1
way ran beginning run homework responsibility mom running sandal hand ready kill,-1
alien florence wanted watch game threw glitter celebration probably hella disappointed canceled game trying turn,-1
cat declawed previous owner many behavioral issue typical declawed cat vet yesterday litter box issue vet brought fact declawed declawing inflicts lifelong trauma animal,-1
apple western northern people realize expensive apple iphone ect lol every year new model ridiculous id rather buy food spend extra cash flow kid family community wasteful,-1
shit go viral,-1
everything applied cause side effect,-1
amount people obsessed nostalgia day one actually nostalgic year,-1
already big crash inflation catastrophe cpi report colossal failure bring housing market halt fed pull stop unfortunate issue market decimatedif want stay green rely lot diversification currently careful still better deal leaving saving checking account yielding percent interest,-1
whats advertising comment broker look fishy shot dark really one enlist service registered advisor seeking method account invest without paying much tax,-1
people learn easier interested enjoying know topic also understand schooling obligation attend school satisfying grade education acquire knowledge studying self interest clearer learn want know also several government regulation school around globe actually making people dumber,-1
unpredidented former president subjec search home yep inciting insurrection failing oversee peaceful transfer power hypocrits much,-1
remember deleted bonus episode chapter actually watch maybe didnt know really like watch react rise bangtan beginning seem bit weird dont finish chapter moving reaction always seems genuine made question wether actually want continue series fair id dont weird sorry,-1
certainly remember much better creative younger im freshman high school ive noticed im much worse whole creativity thing problem im praised great finding one answer take test well typically best project math best subject english worst typically write creative essay want engineer school elective called preengineering one closest class actual job thats available school im best sure math required coming idea better design hard feel show education opposite preparing future telling there one answer never case engineering hope soon enough education overhaul realize need change education,-1
ive always gotten little confused people classified worst year alive many past year didnt much technology go like pandemic like least stuff locked home,-1
think one greatest loss history people think egypt china far yes quite distant would take individual month wasnt individual series people didnt plane combustion engine doesnt mean people werent crossing continent person person people friendly neighborhood druid,-1
fastpaced cant keep,-1
whole scene caught guard tbh,-1
arsenal hater didnt beat anyone game season also arsenal hater last season beat championship team lost three game staring relegation,-1
ive hated calzone day made home every time tried calzone fast food restaurant filling like boiled inside blah dont like way stopped ordering started cooking,-1
repeating thing,-1
think binance killing currently charging fee btc trading,-1
remember sidney powell said many vote trump broke algorithm felt iq drop said suspect several people developed actual brain cancer result,-1
think there one flaw million line code youre optimistic lol,-1
tate strangles breathe air,-1
know thing desperate furniture start resemble oceangoing vessel im glad found cruise ship cruise ship really make handpaddle way aboard,-1
airline need stop taking money service render,-1
dont get say stray racist game take seriously one innumerable example people really criminalinappropriate thing work punish accordingly someone shred integrity report withhold judgement,-1
turn competent lawyer wont actually sit front federal judge lie,-1
ever heard line knew everything literature except enjoy kinda applies never analyze book film first go take away magic,-1
tip whats weakness question sure offer weakness directly needed job like need organized job dont say weakness people several weakness offer something directly needed job applying even youre saying something youve overcome youre working dont want offer reason hire also sure watch facial expression may super passionate thinking dont want come angry frowning smile every haha much,-1
would pretty nasty cod team right,-1
actually currently september left day ago would week two arch duke franz ferdinand assassinated englishman like friend wouldnt known fullblown world war clack since austriahungary wouldnt declare war week set sail,-1
tell mase dont need rapping nothing miss go home mase,-1
want happiness special talent making ourself miserable cdostoevsky,-1
great great grandmother boarded slave ship africa picture wasnt long ago call get forget disrespectful endure could live,-1
trump adonis last two word would expected hear sentence even today agree first statement saying biden could defend dont think everyone would look email see sermon setting someone straight telling unexpected improper isnt sermon giving wakeup call also yes physician ever pas judgement like without examining person first rude unprofessional basically flaunted status dr troll inb trump tweet bi im fabulous,-1
chance becoming homicide victim u even close correct recorded one thought hmm seems high first two thing find google chance murdered united state given year specifically fatality per every people,-1
find people ive sadly thought everyday year,-1
ever eat hand never indian pakistaniessri lankans desi pal pathetic,-1
dud movie voice sync actor could call typical bgrade wan na be give five turd rating five,-1
valuable advice easy overthink completely lose track end goal detrimental future thanks ali,-1
everyones understandind situation relative subjective experience unfair make comparison bewtween past present without taking account different variable practically impossible like electricity going saying think thats bad ackchually human lived without electricity thousand yeears course thats ridiculous statement human past nearly dependent electricity even though may important u electricity month could mean dissolution world know please dont make ignorant comparison present past thing indeed simple,-1
guy many hit headamerica trouble,-1
bonus reward good work company went bankrupt good job,-1
stalemate thing rarely happens every game play oh boy wrong,-1
video good two minor criticism one structural biology concerned structure large macromolecule amino acid small molecule fall purview biochemistry description almost verbatim one sentence opening paragraph wikipedia page structural biology dont think thats correct biomedical engineering field make artificial organ medical device biotechnology us living organism product purpose synthetic biology creates synthetic organism closely related biotechnology latter two field arent closely related first,-1
oh damn never realized hell kitchen actual restaurant wonder get pissed people absolutely destroy expensive food thats baby,-1
bro random dog soccer field stopping goal like he airbud tear,-1
food doesnt look amazing basically normal meal wrapped gold say shove another pizza roll mouth,-1
fact one talking abt luna saying want quickie oh shouldnt say,-1
transphobic ugh people absolutely insufferable people actually willingly surround people like,-1
ill never forget devastating story judge who information posted online consequently teenaged son murdered answered door home acceptable,-1
long allow clown continue thses charade embarrassing nation democracy one else would even come close tolerated,-1
p fanboys game pas full fodder one want play also p fanboys cant wait life p,-1
holy crap looking chroma system back designing power supply look like guy went multimeter oscilloscope terrible making accurate voltage measurement bit adcs looking waveform,-1
part problem million sold home large company like black rock instead actual family type company want money jack rent never sell home family know everyone want money think twice selling home company every time prevent family able afford home subject outrageous rent price speak experience,-1
weve already market hell lol point nothing surprise get emotional eth drop btc less wouldnt even care anymore honestly point dont chip buy dip unfortunately sure hell aint selling till im sitting pretty,-1
way sat score accurate yea okay someone doesnt know scoring work,-1
ptsd clinical depression always feel tired ive subjected thing wouldnt wish anyone even way easier trying get bed please take care treatment depression effective dont worry potential side effect one common side effect depression pas away,-1
confidently poach one egg time using vortex method blowing mind poaching multiple egg,-1
dave winfield new york yankee accidentally hit killed seagull baseball toronto v blue jay august charged cruelty animal autopsy even done seagull created lot controversy toronto,-1
people fail lack effort lack patience much im video youtube totally understand people quit really challenging sometimes motivation continue anyway great video,-1
im brazil heard rancher telling story time grandpa saw harpy lifting newborn calf duting youth day harpy snatched hound gois clearly exagerations wild tale show reverence respect even fear harpy command people also state police im harpia callsign helicopter,-1
non way bro x make swish break brother ankle non cant even dribble,-1
year returning say ive accepted job offer good salary journey started video november first source information got back work cable tech typed python full course something along line course back lot concept like class inheritance meant nothing video perhaps wasnt beginner friendly however sick job absolutely saw growth cable salary cap technician probably job base pay part decided google every single thing dont understand successfully changed career,-1
ill never understand opposing team helping player outunawareness aside stupid thing help,-1
pierre changed whole production style many people copying beat,-1
arsenal weaponry tactic engagement pressed urgency primal intent disable like dont play boxing nature dont play much learn within segment much learn,-1
person rarely play console hasnt owned one year much relate knowing button friend going ok press rt lt go left im constantly checking button right top left top left,-1
lyric go kinda wan na friend take easy im afraid youre never satisfied go sick like animal play pretend youre cannibal im afraid wont get alive wont sleep tonight oh oh want oh oh waiting take bite heart tonight oh oh want oh oh waiting waiting say goodbye heart tonight feel chemical kickin getting heavy wan na run hide wan na run hide every time youre killin wont denied animal inside oh oh want oh oh waiting take bite heart tonight oh oh want oh oh waiting waiting say goodbye heart tonight hush hush world quiet hush hush cant fight u made mess cant understand whoa wont sleep tonight wont sleep tonight go x oh oh want oh oh waiting take bite heart tonight oh oh want oh oh waiting waiting waiting go oh oh x say goodbye heart tonight oh oh want oh oh waiting waiting say goodbye heart tonight,-1
first couple minute made feel like jumped koolaid without knowing flavor kissed oooooh ok lemonade mixed saddness betrayal,-1
feminist find there rea sociedad real sociemom,-1
lady destroyed racism year ago respect,-1
dont know could carry living got banned gmod server,-1
wtf make landlord think theyre entitled make pandemicrelated loss special deserving immune exempted taking hit people werent able go work several month live saving become homeless demand raise make money didnt make landlord bank allowed demand share burden,-1
great pyramid built yeah im still wondering show sure didnt explain built,-1
really appreciate covering colorblind aspect grey instead green black instead orange cube color deficiency mean significantly less choice cube frustraiting,-1
used love high fashion learn go industry feel like pursuing different career choice much nepotism elitism lack creativity almost dont fit within certain enclave youre welcomed,-1
man got crossed bad split hilarious,-1
im defending destroying document im defending man broke federal law destroying document,-1
drop phone call pixel terrible came dropped call,-1
imagine resistance member youre able kill higher rank member germany dude fly air yell rdm,-1
bass line beginning really giving shiver,-1
worst thing happen fashion influencers encourage always wanting next instead appreciating classic theyre fickle encourage everyone else,-1
also may wise learn matlab fairly advanced level ml jump basic python ml quite big one able make jump got fired job must know populate matrix row column take average etc basic python course wont cover thing matlab course specific type thing machine learning engineer data scientist,-1
subpoena he stall time hell string along week month end say changed mind subpoena anyway cut chase already get done,-1
one scariest encounter ever,-1
wonderful group car would tough time choosing lotus gtrs thought color combo ferrari poor taste look good eye,-1
people disliked must made bed dont know feel make,-1
dude contradicts multiple timessometimes within sentence lol see kkk wrecked life anything dude lost love life still obvious love miss belief make impossible together know love love say love see color say race mixing wrong lol think heart speaks truth whats brainwashed come thats contradicts much,-1
sound like great way develop ptsd anxiety panic disorder youll end issue didnt start one,-1
imagine terminator programmed white supremacist realize elon musk completely ignores racism tesla turned authoritarian facist he creating sentient android oh he south african emerald farmer republican claim robot went crazy,-1
vimlark game engine run gas run human suffering,-1
fact came kotaku mean cant taken serious,-1
look absolutely ridiculous im,-1
would cool incorporated last intel model change refresh rate hz great would assume would help battery lower refresh rate standard youre viewing movie suck apple made limitation limitation thunderbolt soc feel argument many people dont use dual monitor setup really true especially work place sister us dual monitor working home us one miniwork tower thing tempts air weight portability amount power given specific spec less wellrounded however im bumping storage unified memory wouldnt far pro macbook pro price strangely would lighter current outdated nonretina macbook pro cool thing model upgradability even novelty thats losing veneer year given limited option upgrade im hanging onto backup computer really ought start saving uptodate laptop smudging thing annoying see awesome color clean often enticing besides size portability power loud fan spinning another thing ive yet experience work work desktop tower im used noise suppose,-1
apparently forgot oath took signed service,-1
someone tell never list quantity ingredient long let thing sit,-1
poor imitation lofigirl channel,-1
company working moved operation china time thinking dumbass cost fellow employee job figured matter time china u would impasse company going get yanked china close took longer figured start diversifying supply chain located,-1
remember watching black fish hearing one sailor sent capture first set orca calf remark getting calf boat vocalization heard made realize taking baby family cry really unnerving information college student aiming become scientist,-1
inflation stay current level soon later bond market collapse following collapse stock market option keep tightening money supply inflation back sustainable level effect year horrific monetary policy qe much stimulus fed added trillion debt balance sheet since plan reduce deficit failed contrary continue increase deficit year blame ukraine war covid caused inflation reality poor monetary policy made central government decade question left much tightening without causing hard recession already vulnerable economy,-1
still clapped british teeth,-1
born dhaka never even heard muslin make really sad think much culture knowledge destroyed,-1
ill glad whole trump drama year bad play much audience member endure,-1
suck suck dugin unfortunate car destroyed process,-1
bro lady hyped kendricks new album almost died strike type listen kdot,-1
ronaldo dirty right,-1
document leaving oval office automatically declassified least record document removed otherwise anyone could take anything would declassified notice old game first excuse fall apart second excuse also fall flat next excuse something wrong change explanation cause proven wrong,-1
real mystery earth two girl story secret bunker bunker put show important mystery though dont watch video content aired something google earth cant even reveal,-1
thank pete planning trip missing wedding funeral excuse selling every flight need factor weather schedule,-1
tried already jumbled cube didnt workeven got messed even lol absolutely instructed,-1
yes airline pay hotel food transportation airport full refund make billion u get sleep airport floor yes make responsible mess ups,-1
conveniently leaving voter opinion medium far worst institution,-1
didnt understand anything video,-1
father actually died fall trying get son ball sad,-1
feel like every time mix hard puzzle doesnt solve come bit closer dying,-1
im concerned federal government sending worker sneak saskatchewan trespass private property there sending mp taiwan stir war pot also anyone else notice enthusiastic greeting deputy tweak gave german chancellor know he probably hot shower,-1
bro way got angry friend told truth lmao,-1
im honestly quite confused hasnt taken court yet nutrition fact make sense,-1
biology major video made feel sad great professional passionate job man,-1
got chill dont make timeless music like,-1
worked retail life one thing never forgotten fact lose customer going play hell trying get back regardless,-1
hardest x,-1
something clearly wrong pie chart,-1
moody manipulative selfserving man mitch mcconnell,-1
imagine randomly digging area finding mrbeast lying bottle piss,-1
bizarre people extremely judgmental dont look mirror guess,-1
die laughing stupid video especially part,-1
oh broadcast face delayed dont see hikaru reacting blunder guy responds move real time hikaru reaction danya soon played move haha hate happens right let go piece see bad,-1
video footage elk ripping front brother law pick truck apart pissed brother law made sound male thing yard away let tell felt like barely made truck time foot u ive never seen power real life insane vancouver island info,-1
every year month june august reason people lose job union getting paid disorder,-1
rahul used debate dumb north indian politician lost whole plot mr thiagarajan nailed,-1
put cube strange shape annoyed put orange red,-1
person literally anything cinema summary biggest mistake,-1
normal computer playing dinosaur game school computer owner device turned dinosaur game,-1
id never make mozzarella much responsibility desi level human,-1
thats exactly switch game need something hinder performance bog stuff brilliant,-1
find interesting law enforcement job gentleman would choose obstruct persuit justice rather support investigator job,-1
fun fact release book sorrow young werther caused chain reaction suicide europe cause suicide effect later called werthereffect,-1
anxiety point considering going meetup even sitting parking lot venue felt hard good job making happen,-1
people got better score think sat show well take testnot well understand subject im terrible test taker,-1
dont ask posted hour official apple announcement wizard time machine please disregard rumor saying time machine,-1
imagine losing cursor screen trying find,-1
he telling sad story afterhours face demolished come back like look girl fixed take back tragedy cause matter much fix face image hell still villain he always still causing trouble villain broke heart,-1
make people stop cheating alright im going openly use method cheating tell anyone everyone,-1
daisy dont say hi lorelei owe money pov character go lorelei first give paper say daisy nothing else damn savage,-1
cant understand area look genuinely breathtaking others floating disjoined rail wall dont understand there massive difference,-1
relaxing isnt vocal instrumental vocal killed vibe,-1
feel cost pro series controller one series pro controller bought used frankly disappointed using rubber side began warp peel buy third party replacement part swap little plate right xbox doesnt offer replacement part find kinda lame considering rubber warping fairly common issue honest would prefer option buy plastic plate rather rubber one cause issue isnt going go away using controller extended amount time paddle nice buy like game cost buy third party controller scrub less get functionality hey would really love ability make custom pro controller design lab would pay extra stand right ill stick standard series x controller,-1
sub speak well english wonna understand movie,-1
reason eu low fact country eu italy spain portugal cyprus since still large debt european bank therefore raise interest rate country repay debt properly debt becomes higher unfortunately country still anything country ensure internal economy run better,-1
kevin give k barbara give k kevin greedy,-1
life wholesome laddish time drunk gambling layabout pestering gypsy woman getting bored becoming officer penning literary masterpiece inner kindness understanding walking family dying pneumonia absolute madman,-1
love way teach adhd never pay attention thanks weird boring like professor adhd affect remembering thing want actually know learn subject subject memorize test forget everything month later advice studying tip really keep info embedded mind,-1
real estate one dead market tied collapse everything though,-1
poor greg side effect vegan kicking,-1
hurt ha father feel pain like influenced,-1
first woman literally looked insane,-1
never life think eating fruit would gamble never life know fruit even existed,-1
well go end tarp fishing calmly tell big as crocgator get back,-1
grade school teacher used tell u repeatedly sin find trump must skipped class would explain reckless criminality many level mention basic stupidity far michael cohen concerned there guy us brain demonstrates courage contrition humility renewed sense civic pride stark contrast trump behavior,-1
quick question got previous official sat made stupid math mistake killed english section part still clutch get bunch studying strechthis first sat btw,-1
cant wait hear mark dice voice one wow stelteryou got three decade old show canceled bad know know scoundrel medium better youre gone said he excited watch cnn root lie fake applause end appropriate lousy host,-1
driving crazy isnt medium asking key question take document,-1
judge issue search warrant sign authorize,-1
didnt even exist want go back time bad live teenage year like,-1
send rubiks impossible different angle doesnt look solved,-1
honest whole thing youre right dont study knowledge accumulated th th grade know trick wealthy people pay test thats way possible get high score like special system weed people cant afford go college feel sorry education affordable,-1
mastering cooking game hour also still sucking cook real life,-1
legend say bait scammer still baiting innocent helpless noobs,-1
understand pay exclusive game platform competitor subscription service blocking rd party multi platform game shitty,-1
although shes wrong math part definitely believe professor like make learning c harder,-1
market heavily effected tweet isnt based reality home gallon gas milk etc always demand cant say price doubled economics economy dynamic always favor rich price never fall current crisis significantly,-1
blow mind people internet simulating police traffic stop,-1
take deep exception image ozzy osborne used example celebrity known ozzy veritable treasure god music dare right kardashians really wtf,-1
expect leader class character exposed,-1
